{
  "started_at": "2026-08-11T09:00:00+08:00",
  "completed_at": "2026-08-11T09:03:00+08:00",
  "platform": "generic-computer-use",
  "launch": {"result": "pass", "command": "APP_COMMAND", "window": "APP_WINDOW"},
  "login": {"required": true, "result": "pass", "role": "系统管理员"},
  "actions": [
    {"capture_id": "dashboard-result", "action": "登录后执行一次核心处理", "result": "pass"}
  ],
  "captures": [
    {"id": "dashboard-result", "source_path": "captures/dashboard-result.png",
     "url": "app://APP/dashboard", "role": "系统管理员", "captured_at": "2026-08-11T09:02:30+08:00"}
  ]
}
